{
  "event_id": "10000000-0000-4000-8000-000000000001",
  "event_type": "ticket.closed",
  "event_version": 1,
  "organization_id": "20000000-0000-4000-8000-000000000001",
  "aggregate_type": "ticket",
  "aggregate_id": "30000000-0000-4000-8000-000000000001",
  "aggregate_version": 7,
  "occurred_at": "2026-09-18T10:00:00Z",
  "correlation_id": "40000000-0000-4000-8000-000000000001",
  "causation_id": null,
  "traceparent": null,
  "payload": {
    "reference_id": "closure_example_1",
    "job_id": "50000000-0000-4000-8000-000000000001",
    "expected_lifecycle_revision": 2,
    "changed_fields": [
      "status",
      "closed_at",
      "closed_by",
      "current_cycle_id"
    ]
  }
}
